{
  "base_currency": "PLN",
  "as_of": "2026-06-11",
  "cash_pln": 5000.0,
  "positions": [
    {
      "isin": "IE00B5BMR087",
      "value_pln": 3200.0,
      "label": "SXR8"
    },
    {
      "isin": "IE0006WW1TQ4",
      "value_pln": 3600.0,
      "label": "EXUS"
    },
    {
      "isin": "IE00BKM4GZ66",
      "value_pln": 1700.0,
      "label": "IS3N"
    },
    {
      "isin": "IE00B4ND3602",
      "value_pln": 1500.0,
      "label": "EGLN"
    }
  ],
  "target": [
    {
      "isin": "IE00B5BMR087",
      "weight": 0.30
    },
    {
      "isin": "IE0006WW1TQ4",
      "weight": 0.40
    },
    {
      "isin": "IE00BKM4GZ66",
      "weight": 0.15
    },
    {
      "isin": "IE00B4ND3602",
      "weight": 0.15
    }
  ]
}
